{
  "messageId": "message-id-example",
  "type": "AllocationRejected",
  "version": "1.0.0",
  "occurredAt": "2026-09-08T12:00:00Z",
  "tenantId": "tenant-id-example",
  "regionId": "region-id-example",
  "clusterId": "cluster-id-example",
  "correlationId": "correlation-id-example",
  "data": {
    "sessionId": "session-id-example",
    "ownerEpoch": "1",
    "engineId": "engine-id-example",
    "incarnationId": "incarnation-id-example",
    "allocationId": "allocation-id-example",
    "code": "unauthenticated"
  },
  "aggregateId": "aggregate-id-example",
  "aggregateRevision": "1",
  "causationId": "causation-id-example"
}
